Symbol,Name,Last Sale,Net Change,% Change,Market Cap,Country,IPO Year,Volume,Sector,Industry
PIM,Putnam Master Intermediate Income Trust Common Stock,$3.155,-0.005,-0.158%,158549458.00,United States,1988,5923,Finance,Finance Companies
PINE,Alpine Income Property Trust Inc. Common Stock,$15.28,0.15,0.991%,208084690.00,United States,2019,6461,Real Estate,Real Estate Investment Trusts
PINS,Pinterest Inc. Class A Common Stock,$34.185,-0.095,-0.277%,23211046127.00,United States,2019,773259,Technology,Computer Software: Programming Data Processing
PIPR,Piper Sandler Companies Common Stock,$199.76,-0.23,-0.115%,3532271582.00,United States,,7356,Finance,Investment Bankers/Brokers/Service
PJT,PJT Partners Inc. Class A Common Stock,$96.78,0.16,0.166%,2314724811.00,United States,2015,7793,Finance,Investment Managers
PK,Park Hotels & Resorts Inc. Common Stock ,$17.50,0.11,0.633%,3685193260.00,United States,2016,256169,Real Estate,Real Estate Investment Trusts
PKE,Park Aerospace Corp. Common Stock,$16.13,0.06,0.373%,326686713.00,United States,,664,Industrials,Military/Government/Technical
PKG,Packaging Corporation of America Common Stock,$188.77,1.10,0.586%,16918344944.00,United States,2000,45959,Consumer Discretionary,Containers/Packaging
PKST,Peakstone Realty Trust Common Shares,$15.0771,0.1071,0.715%,547388544.00,United States,2023,14524,Real Estate,Real Estate Investment Trusts
PKX,POSCO Holdings Inc. American Depositary Shares (Each representing 1/4th of a share of Common Stock),$75.005,1.455,1.978%,22756270084.00,South Korea,1994,16232,Industrials,Steel/Iron Ore
PL,Planet Labs PBC Class A Common Stock,$2.065,-0.035,-1.667%,600130682.00,United States,2021,473539,Industrials,Aerospace
PLD,Prologis Inc. Common Stock,$125.57,0.83,0.665%,116137307170.00,United States,,215240,Real Estate,Real Estate Investment Trusts
PLNT,Planet Fitness Inc. Common Stock,$62.92,-0.22,-0.348%,5546203703.00,United States,2015,162298,Consumer Discretionary,Hotels/Resorts
PLOW,Douglas Dynamics Inc. Common Stock,$22.03,-1.97,-8.208%,506336749.00,United States,2010,172674,Industrials,Construction/Ag Equipment/Trucks
PLTR,Palantir Technologies Inc. Class A Common Stock,$23.025,0.065,0.283%,50948177141.00,United States,2020,8297037,Technology,Retail: Computer Software & Peripheral Equipment
PLYM,Plymouth Industrial REIT Inc. Common Stock,$21.63,0.21,0.98%,981614304.00,United States,2017,5853,Real Estate,Real Estate Investment Trusts
PM,Philip Morris International Inc Common Stock,$89.97,0.49,0.548%,139674520032.00,United States,,603677,Health Care, Medicinal Chemicals and Botanical Products 
PMF,PIMCO Municipal Income Fund Common Stock,$9.105,-0.025,-0.274%,0.00,United States,2001,86066,Finance,Finance/Investors Services
PML,Pimco Municipal Income Fund II Common Shares of Beneficial Interest,$8.45,0.04,0.476%,0.00,United States,2002,57045,Finance,Investment Managers
PMM,Putnam Managed Municipal Income Trust Common Stock,$5.925,0.025,0.424%,288777443.00,United States,1989,9563,Finance,Investment Managers
PMO,Putnam Municipal Opportunities Trust Common Stock,$9.94,0.03,0.303%,337776776.00,United States,1993,12693,Finance,Finance Companies
PMT,PennyMac Mortgage Investment Trust Common Shares of Beneficial Interest,$14.42,0.02,0.139%,1249440583.00,United States,2009,121505,Real Estate,Real Estate Investment Trusts
PMT^A,PennyMac Mortgage Investment Trust 8.125% Series A Fixed-to-Floating Rate Cumulative Redeemable Preferred Shares of Beneficial Interest,$23.70,0.00,0.00%,,United States,,72,,
PMT^B,PennyMac Mortgage Investment Trust 8.00% Series B Fixed-to-Floating Rate Cumulative Redeemable Preferred Shares of Beneficial Interest,$23.60,-0.02,-0.085%,,United States,,1443,,
PMT^C,PennyMac Mortgage Investment Trust 6.75% Series C Cumulative Redeemable Preferred Shares of Beneficial Interest,$19.25,0.05,0.26%,,United States,,12763,,
PMTU,PennyMac Mortgage Investment Trust 8.50% Senior Notes due 2028,$25.30,0.10,0.397%,0.00,United States,2023,28047,,
PMX,PIMCO Municipal Income Fund III Common Shares of Beneficial Interest,$7.44,0.08,1.087%,0.00,United States,2002,51557,Finance,Trusts Except Educational Religious and Charitable
PNC,PNC Financial Services Group Inc. (The) Common Stock,$160.34,2.97,1.887%,63784552678.00,United States,,270595,Finance,Major Banks
PNF,PIMCO New York Municipal Income Fund Common Stock,$7.61,0.01,0.132%,0.00,United States,2001,361,Finance,Finance Companies
PNI,Pimco New York Municipal Income Fund II Common Shares of Beneficial Interest,$7.24,-0.01,-0.138%,0.00,United States,2002,1597,Finance,Trusts Except Educational Religious and Charitable
PNM,PNM Resources Inc. (Holding Co.) Common Stock,$37.36,0.16,0.43%,3369886346.00,United States,,52778,Utilities,Electric Utilities: Central
PNNT,PennantPark Investment Corporation Common Stock,$6.865,-0.075,-1.081%,447766193.00,United States,2022,134210,Finance,Finance: Consumer Services
PNR,Pentair plc. Ordinary Share,$83.73,0.16,0.191%,13843458773.00,Switzerland,,103795,Industrials,Industrial Machinery/Components
PNST,Pinstripes Holdings Inc. Class A Common Stock,$3.25,0.14,4.502%,130285305.00,,2022,3469,Finance,Blank Checks
PNW,Pinnacle West Capital Corporation Common Stock,$73.56,0.80,1.10%,8343717117.00,United States,,52193,Utilities,Electric Utilities: Central
POR,Portland General Electric Co Common Stock,$41.67,0.32,0.774%,4215435791.00,United States,,55636,Utilities,Electric Utilities: Central
POST,Post Holdings Inc. Common Stock,$102.07,0.07,0.069%,6193731921.00,United States,2012,19913,Consumer Staples,Packaged Foods
PPG,PPG Industries Inc. Common Stock,$139.78,0.74,0.532%,32883897074.00,United States,,118050,Consumer Discretionary,Paints/Coatings
PPL,PPL Corporation Common Stock,$27.40,0.18,0.661%,20210333379.00,United States,,446148,Utilities,Electric Utilities: Central
PPT,Putnam Premier Income Trust Common Stock,$3.49,0.02,0.576%,347353638.00,United States,1988,20573,Finance,Finance Companies
PR,Permian Resources Corporation Class A Common Stock,$17.705,-0.225,-1.255%,13665819667.00,United States,2022,1422399,Energy,Oil & Gas Production
PRA,ProAssurance Corporation Common Stock,$12.48,0.08,0.645%,636111266.00,United States,,26416,Finance,Property-Casualty Insurers
PRE^J,PartnerRe Ltd. 4.875% Fixed Rate Non-Cumulative Redeemable Preferred Shares Series J,$21.40,0.00,0.00%,,Bermuda,,1182,,
PRG,PROG Holdings Inc. Common Stock,$33.66,0.32,0.96%,1470562046.00,United States,,17090,Consumer Discretionary,Diversified Commercial Services
PRGO,Perrigo Company plc Ordinary Shares,$31.70,0.30,0.955%,4295855266.00,United States,,146308,Health Care,Biotechnology: Pharmaceutical Preparations
PRH,Prudential Financial Inc. 5.950% Junior Subordinated Notes due 2062,$25.95,-0.05,-0.192%,9316050000.00,United States,2022,2198,Finance,Life Insurance
PRI,Primerica Inc. Common Stock,$247.91,1.24,0.503%,8639059095.00,United States,2010,6241,Finance,Life Insurance
PRIF^D,Priority Income Fund Inc. 7.00% Series D Term Preferred Stock due 2029,$22.88,-0.01,-0.044%,,,,200,,
PRIF^F,Priority Income Fund Inc. 6.625% Series F Term Preferred Stock due 2027,$23.34,0.0384,0.165%,,,,155,,
PRIF^G,Priority Income Fund Inc. 6.25% Series G Preferred Stock Due 2026,$23.79,0.00,0.00%,,,,100,,
PRIF^H,Priority Income Fund Inc. 6.00% Series H Term Preferred Stock due 2026,$23.13,0.00,0.00%,,,,7,,
PRIF^I,Priority Income Fund Inc. 6.125% Series I Term Preferred Stock due 2028,$22.28,0.06,0.27%,,,,200,,
PRIF^J,Priority Income Fund Inc. 6.000% Series J Term Preferred Stock due 2028,$22.12,-0.18,-0.807%,,,,271,,
PRIF^K,Priority Income Fund Inc. 7.000% Series K Cumulative Preferred Stock,$20.95,0.00,0.00%,,,,174,,
PRIF^L,Priority Income Fund Inc. 6.375% Series L Term Preferred Stock Due 2029,$22.565,-0.365,-1.592%,,,,1120,,
PRIM,Primoris Services Corporation Common Stock,$46.68,-0.08,-0.171%,2494433745.00,United States,,24449,Industrials,Water Sewer Pipeline Comm & Power Line Construction
PRKS,United Parks & Resorts Inc. Common Stock,$57.41,0.71,1.252%,3672521604.00,United States,2013,91580,Health Care,Biotechnology: Electromedical & Electrotherapeutic Apparatus
PRLB,Proto Labs Inc. Common stock,$34.20,-0.06,-0.175%,879690929.00,United States,2012,5867,Industrials,Metal Fabrications
PRM,Perimeter Solutions SA Ordinary Shares,$7.595,-0.195,-2.503%,1106847368.00,Luxembourg,2021,66070,Consumer Discretionary,Newspapers/Magazines
PRMW,Primo Water Corporation Common Stock,$17.975,0.055,0.307%,2867210369.00,Canada,,58432,Consumer Staples,Beverages (Production/Distribution)
PRO,PROS Holdings Inc. Common Stock,$38.00,0.14,0.37%,1776037540.00,United States,2007,43038,Technology,EDP Services
PRS,Prudential Financial Inc. 5.625% Junior Subordinated Notes due 2058,$25.07,-0.03,-0.12%,9000130000.00,United States,2018,2373,Finance,Life Insurance
PRT,PermRock Royalty Trust Trust Units,$4.3772,0.1372,3.236%,53251842.00,United States,2018,10338,Energy,Oil & Gas Production
PRU,Prudential Financial Inc. Common Stock,$115.61,-0.10,-0.086%,41503990000.00,United States,2001,149976,Finance,Life Insurance
PSA,Public Storage Common Stock,$284.485,1.915,0.678%,49981569067.00,United States,,36551,Real Estate,Real Estate Investment Trusts
PSA^F,Public Storage Depositary Shares Each Representing 1/1000 of a 5.15% Cumulative Preferred Share of Beneficial Interest Series F par value $0.01 per share,$24.18,0.03,0.124%,,United States,,426,,
PSA^G,Public Storage Depositary Shares Each Representing 1/1000 of a 5.05% Cumulative Preferred Share of Beneficial Interest Series G,$24.11,-0.07,-0.289%,,United States,,1499,,
PSA^H,Public Storage Depositary Shares Each Representing 1/1000 of a  5.60% Cumulative Preferred  Share of Beneficial Interest Series H,$24.8299,0.0099,0.04%,,United States,,1257,,
PSA^I,Public Storage Depositary Shares Each Representing 1/1000 of a 4.875% Cumulative Preferred Share of Beneficial Interest Series I par value $0.01 per share,$22.51,-0.02,-0.089%,,United States,,14225,,
PSA^J,Public Storage Depositary Shares Each Representing 1/1000 of a 4.700% Cumulative Preferred Share of Beneficial Interest Series J par value $0.01 per share,$21.25,0.00,0.00%,,United States,,268,,
PSA^K,Public Storage Depositary Shares Each Representing 1/1000 of a 4.75% Cumulative Preferred Share of Beneficial Interest Series K,$21.42,-0.14,-0.649%,,United States,,2545,,
PSA^L,Public Storage Depositary Shares Each Representing 1/1000 of a 4.625% Cumulative Preferred Share of Beneficial Interest Series L par value $0.01 per share,$21.41,0.09,0.422%,,United States,,3153,,
PSA^M,Public Storage Depositary Shares Each Representing 1/1000 of a 4.125% Cumulative Preferred Share of Beneficial Interest Series M,$19.17,0.00,0.00%,,United States,,1008,,
PSA^N,Public Storage Depositary Shares Each Representing 1/1000 of a 3.875% Cumulative Preferred Share of Beneficial Interest Series N,$17.72,-0.04,-0.225%,,United States,,2415,,
PSA^O,Public Storage Depositary Shares Each Representing 1/1000 of a 3.900% Cumulative Preferred Share of Beneficial Interest Series O,$17.78,-0.08,-0.448%,,United States,,173,,
PSA^P,Public Storage Depositary Shares Each Representing 1/1000 of a 4.000% Cumulative Preferred Share of Bene cial Interest Series P,$18.72,0.09,0.483%,,United States,,2953,,
PSA^Q,Public Storage Depositary Shares Each Representing 1/1000 of a 3.950% Cumulative Preferred Share of Beneficial Interest Series Q par value $0.01 per share,$17.86,-0.0901,-0.502%,,United States,,1178,,
PSA^R,Public Storage Depositary Shares Each Representing 1/1000 of a 4.00% Cumulative Preferred Share of Bene cial Interest Series R,$18.6499,0.0899,0.484%,,United States,,4511,,
PSA^S,Public Storage Depositary Shares Each Representing 1/1000 of a 4.100% Cumulative Preferred Share of Beneficial Interest Series S,$18.99,0.04,0.211%,,United States,,1143,,
PSBD,Palmer Square Capital BDC Inc. Common Stock,$16.235,0.045,0.278%,0.00,,2024,2418,,
PSEC^A,Prospect Capital Corporation 5.35% Series A Fixed Rate Cumulative Perpetual Preferred Stock,$18.95,-0.06,-0.316%,,United States,,374,,
PSF,Cohen & Steers Select Preferred and Income Fund Inc. Common Stock,$19.95,0.09,0.453%,980315629.00,,2010,656,Finance,Investment Managers
PSFE,Paysafe Limited Common Shares,$16.36,0.33,2.059%,1009730087.00,,2021,52601,Consumer Discretionary,Business Services
PSN,Parsons Corporation Common Stock,$84.7999,0.5199,0.617%,8974337716.00,United States,2019,134304,Technology,EDP Services
PSO,Pearson Plc Common Stock,$12.715,-0.065,-0.509%,8729992549.00,United Kingdom,,69086,Consumer Discretionary,Books
PSQH,PSQ Holdings Inc. Class A Common Stock,$4.89,0.09,1.875%,138324667.00,,2021,10671,Consumer Discretionary,Advertising
PSTG,Pure Storage Inc. Class A Common Stock,$53.78,-0.01,-0.019%,17473676364.00,United States,2015,422849,Technology,Electronic Components
PSTL,Postal Realty Trust Inc. Class A Common Stock,$13.97,0.02,0.143%,314490237.00,United States,2019,16288,Real Estate,Real Estate Investment Trusts
PSX,Phillips 66 Common Stock,$168.885,-1.865,-1.092%,72253128692.00,United States,,332414,Energy,Integrated oil Companies
PTA,Cohen & Steers Tax-Advantaged Preferred Securities and Income Fund Common Shares of Beneficial Interest,$19.0401,0.0001,0.001%,1052412149.00,United States,2020,21677,Finance,Trusts Except Educational Religious and Charitable
PTY,Pimco Corporate & Income Opportunity Fund,$15.09,0.04,0.266%,0.00,United States,2002,290194,Finance,Investment Managers
PUK,Prudential Public Limited Company Common Stock,$18.295,0.035,0.192%,25187831116.00,United Kingdom,,130724,Finance,Life Insurance
PUMP,ProPetro Holding Corp. Common Stock,$8.4267,-0.1733,-2.015%,906435462.00,United States,2017,65554,Energy,Oilfield Services/Equipment
PVH,PVH Corp. Common Stock,$109.56,0.90,0.828%,6320396760.00,United States,,309243,Consumer Discretionary,Apparel
PVL,Permianville Royalty Trust Trust Units ,$1.3717,-0.0083,-0.601%,45266100.00,United States,2011,6112,Energy,Oil & Gas Production
PWR,Quanta Services Inc. Common Stock,$262.035,-1.165,-0.443%,38191332926.00,United States,,54951,Industrials,Engineering & Construction
PWSC,PowerSchool Holdings Inc. Class A Common Stock,$21.12,0.06,0.285%,4278771658.00,United States,2021,41417,Technology,Computer Software: Prepackaged Software
PX,P10 Inc. Class A Common Stock,$8.43,0.03,0.357%,976844248.00,United States,2021,16940,Finance,Investment Managers
PXD,Pioneer Natural Resources Company Common Stock,$270.57,-2.21,-0.81%,63211407849.00,United States,,349039,Energy,Oil & Gas Production
PYN,PIMCO New York Municipal Income Fund III Common Shares of Beneficial Interest,$5.74,0.00,0.00%,0.00,United States,2002,4334,Finance,Investment Managers
PYT,PPlus Tr GSC-2 Tr Ctf Fltg Rate,$23.10,0.00,0.00%,0.00,United States,,90,Finance,Finance: Consumer Services
PZC,PIMCO California Municipal Income Fund III Common Shares of Beneficial Interest,$7.52,-0.01,-0.133%,0.00,United States,2002,4054,Finance,Investment Managers
QBTS,D-Wave Quantum Inc. Common Shares,$1.8597,-0.0203,-1.08%,300680246.00,,2022,1819420,Technology,Retail: Computer Software & Peripheral Equipment
QD,Qudian Inc. American Depositary Shares each representing one Class A Ordinary Share,$2.475,0.055,2.273%,574809657.00,China,2017,315367,Finance,Finance: Consumer Services
QGEN,Qiagen N.V. Common Shares,$41.32,0.15,0.364%,9429337837.00,Netherlands,,90937,Health Care,Biotechnology: Biological Products (No Diagnostic Substances)
QS,QuantumScape Corporation Class A Common Stock,$6.11,0.13,2.174%,3029395568.00,United States,2020,1107601,Consumer Discretionary,Auto Parts:O.E.M.
QSR,Restaurant Brands International Inc. Common Shares,$74.50,-0.05,-0.067%,23265115461.00,Canada,2014,108058,,
QTWO,Q2 Holdings Inc. Common Stock,$53.52,1.06,2.021%,3161651773.00,United States,2014,63716,Technology,EDP Services
QUAD,Quad Graphics Inc Class A Common Stock,$5.17,0.03,0.584%,270298628.00,United States,,21709,Consumer Discretionary,Publishing
QVCC,QVC Inc. 6.250% Senior Secured Notes due 2068,$13.75,0.08,0.585%,14.00,United States,2019,121,Consumer Discretionary,Catalog/Specialty Distribution
QVCD,QVC Inc. 6.375% Senior Secured Notes due 2067,$13.85,0.00,0.00%,14.00,United States,2018,220,Consumer Discretionary,Catalog/Specialty Distribution
R,Ryder System Inc. Common Stock,$119.31,0.71,0.599%,5239319446.00,United States,,4831,Consumer Discretionary,Rental/Leasing Companies
RA,Brookfield Real Assets Income Fund Inc. Common Stock,$12.94,0.045,0.349%,0.00,United States,2016,61630,Finance,Investment Managers
RACE,Ferrari N.V. Common Shares,$423.89,5.03,1.201%,76477424170.00,Italy,2015,27357,Consumer Discretionary,Auto Manufacturing
RAMP,LiveRamp Holdings Inc. Common Stock,$35.975,-0.555,-1.519%,2380959723.00,United States,2018,82803,Technology,EDP Services
RBA,RB Global Inc. Common Stock,$74.67,-0.02,-0.027%,13665862216.00,Canada,,26854,,
RBC,RBC Bearings Incorporated Common Stock,$266.9236,0.8936,0.336%,7789343408.00,United States,2022,10261,Industrials,Metal Fabrications
RBCP,RBC Bearings Incorporated 5.00% Series A Mandatory Convertible Preferred Stock,$119.65,0.00,0.00%,3491616848.00,United States,2022,7,Industrials,Metal Fabrications
RBLX,Roblox Corporation Class A Common Stock,$38.47,0.65,1.719%,24299122516.00,United States,2021,970251,Technology,EDP Services
RBOT,Vicarious Surgical Inc. Class A Common Stock,$0.276,0.002,0.73%,48507462.00,Hong Kong,2020,420344,Health Care,Medical Specialities
RBT,Rubicon Technologies Inc. Class A Common Stock,$0.3667,-0.0206,-5.319%,19602933.00,,2022,93720,Technology,Semiconductors
RC,Ready Capital Corproation Common Stock,$8.76,-0.04,-0.455%,1511577630.00,United States,2013,137705,Real Estate,Real Estate Investment Trusts
RC^E,Ready Capital Corporation 6.50% Series E Cumulative Redeemable Preferred Stock,$18.66,0.00,0.00%,,United States,,1,,
RCB,Ready Capital Corporation 6.20% Senior Notes due 2026,$24.45,0.01,0.041%,4218958112.00,United States,2019,1070,Real Estate,Real Estate Investment Trusts
RCC,Ready Capital Corporation 5.75% Senior Notes due 2026,$24.1726,-0.0274,-0.113%,4171091487.00,United States,2021,753,Real Estate,Real Estate Investment Trusts
RCFA,RCF Acquisition Corp. Class A Ordinary Shares,$11.17,0.02,0.179%,0.00,,2021,111,Finance,Blank Checks
RCI,Rogers Communication Inc. Common Stock,$39.58,-0.04,-0.101%,21027451641.00,Canada,,57662,,
RCL,Royal Caribbean Cruises Ltd. Common Stock,$138.65,2.63,1.934%,35584542882.00,United States,1993,299496,Consumer Discretionary,Marine Transportation
RCS,PIMCO Strategic Income Fund Inc.,$6.12,0.01,0.164%,0.00,United States,1994,14000,Finance,Investment Managers
RCUS,Arcus Biosciences Inc. Common Stock,$17.115,-0.225,-1.298%,1555151548.00,United States,2018,29724,Health Care,Biotechnology: Pharmaceutical Preparations
RDDT,Reddit Inc. Class A Common Stock,$46.77,-0.79,-1.661%,7436106819.00,,2024,911897,,
RDN,Radian Group Inc. Common Stock,$31.79,0.42,1.339%,4816124535.00,United States,,178031,Finance,Property-Casualty Insurers
RDW,Redwire Corporation Common Stock,$4.34,-0.03,-0.686%,284611662.00,United States,2021,40148,Industrials,Military/Government/Technical
RDY,Dr. Reddy's Laboratories Ltd Common Stock,$73.65,-0.11,-0.149%,12264778067.00,India,,11353,Health Care,Biotechnology: Pharmaceutical Preparations
RELX,RELX PLC PLC American Depositary Shares (Each representing One Ordinary Share),$41.805,-0.235,-0.559%,78719786548.00,United Kingdom,2015,274523,Consumer Discretionary,Business Services
RERE,ATRenew Inc. American Depositary Shares (every three of which representing two Class A ordinary shares),$1.695,0.035,2.108%,379381999.00,Cayman Islands,2021,107278,Consumer Discretionary,Other Specialty Stores
RES,RPC Inc. Common Stock,$7.9251,-0.0549,-0.688%,1707426324.00,United States,,151805,Energy,Oilfield Services/Equipment
REVG,REV Group Inc. Common Stock,$23.225,-0.315,-1.338%,1203060458.00,United States,2017,57305,Consumer Discretionary,Auto Manufacturing
REX,REX American Resources Corporation,$58.7312,-0.0688,-0.117%,1028015948.00,United States,,13067,Industrials,Major Chemicals
REXR,Rexford Industrial Realty Inc. Common Stock,$48.93,0.32,0.658%,10524173295.00,United States,2013,170535,Real Estate,Real Estate Investment Trusts
REXR^B,Rexford Industrial Realty Inc. 5.875% Series B Cumulative Redeemable Preferred Stock,$22.18,-0.45,-1.989%,,United States,,560,,
REXR^C,Rexford Industrial Realty Inc. 5.625% Series C Cumulative Redeemable Preferred Stock par value $0.01 per share,$21.42,-0.06,-0.279%,,United States,,517,,
REZI,Resideo Technologies Inc. Common Stock ,$22.15,0.30,1.373%,3218811021.00,United States,2018,46101,Industrials,Wholesale Distributors
RF,Regions Financial Corporation Common Stock,$20.375,0.225,1.117%,18721854978.00,United States,,615232,Finance,Major Banks
RF^B,Regions Financial Corporation Depositary Shares Representing 1/40th Perpetual Preferred Series B,$24.82,-0.02,-0.081%,,United States,,3802,,
RF^C,Regions Financial Corporation Depositary Shares each Representing a 1/40th Interest in a  Share of 5.700% Fixed-to-Floating Rate Non-Cumulative  Perpetual Preferred Stock Series C,$23.15,0.005,0.022%,,United States,,2792,,
RF^E,Regions Financial Corporation Depositary Shares Each Representing a 1/40th Interest in a Share of 4.45% Non-Cumulative Perpetual Preferred Stock Series E,$18.985,0.095,0.503%,,United States,,2196,,
RFI,Cohen & Steers Total Return Realty Fund Inc. Common Stock,$11.54,0.07,0.61%,567059767.00,United States,1993,11744,Finance,Investment Managers
RFL,Rafael Holdings Inc. Class B Common Stock,$1.71,-0.02,-1.156%,42039391.00,United States,2018,808,Health Care,Biotechnology: Pharmaceutical Preparations
RFM,RiverNorth Flexible Municipal Income Fund Inc. Common Stock,$16.36,0.08,0.491%,100036476.00,,2020,3465,Finance,Finance/Investors Services
RFMZ,RiverNorth Flexible Municipal Income Fund II Inc. Common Stock,$14.2423,0.0823,0.581%,346825014.00,,2021,8385,Finance,Trusts Except Educational Religious and Charitable
RGA,Reinsurance Group of America Incorporated Common Stock,$193.39,-0.58,-0.299%,12716759961.00,United States,,11664,Finance,Life Insurance
RGR,Sturm Ruger & Company Inc. Common Stock,$46.755,0.135,0.29%,825889671.00,United States,,13692,Industrials,Ordnance And Accessories
RGT,Royce Global Value Trust Inc. Common Stock,$10.53,0.00,0.00%,65990910.00,,2013,1018,Finance,Trusts Except Educational Religious and Charitable
RH,RH Common Stock,$278.785,0.485,0.174%,5106118170.00,United States,2012,122133,Consumer Discretionary,Other Specialty Stores
RHI,Robert Half Inc. Common Stock,$75.75,0.45,0.598%,7969545314.00,United States,,79944,Consumer Discretionary,Professional Services
RHP,Ryman Hospitality Properties Inc. (REIT),$115.32,-0.37,-0.32%,6885949092.00,United States,,14865,Real Estate,Real Estate Investment Trusts
RIG,Transocean Ltd (Switzerland) Common Stock,$6.49,-0.04,-0.613%,5250610191.00,Switzerland,,4789021,Energy,Oil & Gas Production
RIO,Rio Tinto Plc Common Stock,$65.40,2.40,3.81%,106412883605.00,Australia,2002,1155190,Basic Materials,Metal Mining
RITM,Rithm Capital Corp. Common Stock,$10.875,0.015,0.138%,5255085349.00,United States,,304373,Real Estate,Real Estate Investment Trusts
RITM^A,Rithm Capital Corp. 7.50% Series A Fixed-to-Floating Rate Cumulative Redeemable Preferred Stock,$24.97,0.02,0.08%,,United States,,2986,,
RITM^B,Rithm Capital Corp. 7.125% Series B Fixed-to-Floating Rate Cumulative Redeemable Preferred Stock,$24.80,0.00,0.00%,,United States,,5124,,
RITM^C,Rithm Capital Corp. 6.375% Series C Fixed-to-Floating Rate Cumulative Redeemable Preferred Stock,$22.97,-0.0033,-0.014%,,United States,,1203,,
RITM^D,Rithm Capital Corp. 7.00% Fixed-Rate Reset Series D Cumulative Redeemable Preferred Stock,$23.4098,0.0368,0.157%,,United States,,4290,,
RIV,RiverNorth Opportunities Fund Inc. Common Stock,$11.85,-0.05,-0.42%,0.00,,2015,16987,Finance,Finance Companies
RIV^A,RiverNorth Opportunities Fund Inc. 6.00% Series A Perpetual Preferred Stock,$24.16,0.1351,0.562%,,,,7986,,
RJF,Raymond James Financial Inc. Common Stock,$129.455,1.165,0.908%,27059669770.00,United States,,68267,Finance,Investment Bankers/Brokers/Service
RJF^B,Raymond James Financial Inc. Depositary Shares each representing a 1/40th interest in a share of 6.375% Fixed-to-Floating Rate Series B Non-Cumulative Perpetual Preferred Stock,$25.04,-0.015,-0.06%,,United States,,20311,,
RKT,Rocket Companies Inc. Class A Common Stock,$13.06,0.11,0.849%,25932450760.00,United States,2020,275515,Finance,Finance: Consumer Services
RL,Ralph Lauren Corporation Common Stock,$171.71,-0.24,-0.14%,10976657221.00,United States,1997,84772,Consumer Discretionary,Apparel
RLI,RLI Corp. Common Stock (DE),$143.75,-0.79,-0.547%,6563522938.00,United States,,4459,Finance,Property-Casualty Insurers
RLJ,RLJ Lodging Trust Common Shares of Beneficial Interest $0.01 par value,$11.73,0.06,0.514%,1827348338.00,United States,2011,60025,Real Estate,Real Estate Investment Trusts
RLJ^A,RLJ Lodging Trust $1.95 Series A Cumulative Convertible  Preferred Shares,$24.87,-0.05,-0.201%,,United States,,4966,,
RLTY,Cohen & Steers Real Estate Opportunities and Income Fund Common Shares of Beneficial Interest,$14.22,0.11,0.78%,0.00,,2022,6753,Finance,Investment Managers
RLX,RLX Technology Inc. American Depositary Shares each representing the right to receive one (1) Class A ordinary share,$1.78,-0.02,-1.111%,2796007215.00,Cayman Islands,2021,510793,Health Care, Medicinal Chemicals and Botanical Products 
RM,Regional Management Corp. Common Stock,$24.96,0.30,1.217%,243573333.00,United States,2012,4388,Finance,Finance: Consumer Services
RMAX,RE/MAX Holdings Inc. Class A Common Stock,$7.99,-0.05,-0.622%,146027509.00,United States,2013,37095,Finance,Real Estate
RMD,ResMed Inc. Common Stock,$188.015,-0.745,-0.395%,27654917277.00,United States,,94408,Health Care,Medical/Dental Instruments
RMI,RiverNorth Opportunistic Municipal Income Fund Inc. Common Stock,$15.81,0.00,0.00%,100761367.00,,2018,4930,Finance,Finance/Investors Services
