Symbol,Name,Last Sale,Net Change,% Change,Market Cap,Country,IPO Year,Volume,Sector,Industry
DE,Deere & Company Common Stock,$412.13,-0.41,-0.099%,114719769087.00,United States,,262773,Industrials,Industrial Machinery/Components
DEA,Easterly Government Properties Inc. Common Stock,$11.46,0.13,1.147%,1172984885.00,United States,2015,113729,Real Estate,Real Estate Investment Trusts
DEC,Diversified Energy Company plc Ordinary Shares,$12.95,0.09,0.70%,616108281.00,,,37184,,
DECK,Deckers Outdoor Corporation Common Stock,$879.41,-0.48,-0.055%,22572889350.00,United States,1993,39028,Consumer Discretionary,Shoe Manufacturing
DEI,Douglas Emmett Inc. Common Stock,$13.47,0.35,2.668%,2254230362.00,United States,2006,170375,Real Estate,Real Estate Investment Trusts
DELL,Dell Technologies Inc. Class C Common Stock ,$127.19,-5.53,-4.167%,90786992709.00,United States,2018,3998106,Technology,Computer Manufacturing
DEO,Diageo plc Common Stock,$143.90,-0.54,-0.374%,80364722014.00,United Kingdom,,106074,Consumer Staples,Beverages (Production/Distribution)
DESP,Despegar.com Corp. Ordinary Shares,$12.045,0.215,1.817%,795692700.00,Argentina,2017,200430,Consumer Discretionary,Transportation Services
DFH,Dream Finders Homes Inc. Class A Common Stock,$42.64,-0.28,-0.652%,3976875970.00,United States,2022,40206,Consumer Discretionary,Homebuilding
DFIN,Donnelley Financial Solutions Inc. Common Stock ,$61.275,0.295,0.484%,1782504701.00,United States,2016,4563,Consumer Discretionary,Other Consumer Services
DFP,Flaherty & Crumrine Dynamic Preferred and Income Fund Inc. Common Stock,$18.7401,0.0001,0.001%,0.00,,2013,5718,Finance,Investment Managers
DFS,Discover Financial Services Common Stock,$126.945,1.085,0.862%,31806741797.00,United States,,90342,Finance,Finance: Consumer Services
DG,Dollar General Corporation Common Stock,$157.015,-2.535,-1.589%,34491691682.00,United States,2009,476547,Consumer Discretionary,Department/Specialty Retail Stores
DGX,Quest Diagnostics Incorporated Common Stock,$130.78,0.15,0.115%,14478299779.00,United States,,67779,Health Care,Medical Specialities
DHF,BNY Mellon High Yield Strategies Fund Common Stock,$2.36,0.00,0.00%,0.00,United States,1998,218868,Finance,Finance Companies
DHI,D.R. Horton Inc. Common Stock,$156.59,-1.93,-1.218%,51959268188.00,United States,,339101,Consumer Discretionary,Homebuilding
DHR,Danaher Corporation Common Stock,$244.645,0.365,0.149%,180964328513.00,United States,,374072,Industrials,Industrial Machinery/Components
DHT,DHT Holdings Inc.,$11.485,-0.155,-1.332%,1849079740.00,Jersey,2005,190247,Consumer Discretionary,Marine Transportation
DHX,DHI Group Inc. Common Stock,$2.3875,-0.0025,-0.105%,114677563.00,United States,2007,24394,Consumer Discretionary,Business Services
DIAX,Nuveen Dow 30SM Dynamic Overwrite Fund Common Shares of Beneficial Interest,$14.12,-0.03,-0.212%,0.00,,2014,21269,Finance,Finance Companies
DIN,Dine Brands Global Inc. Common Stock,$44.12,0.90,2.082%,672959933.00,United States,,32258,Consumer Discretionary,Restaurants
DINO,HF Sinclair Corporation Common Stock,$63.03,-0.68,-1.067%,12515766126.00,United States,1960,126757,Energy,Natural Gas Distribution
DIS,Walt Disney Company (The) Common Stock,$117.31,-1.07,-0.904%,215181995188.00,United States,,1589583,Consumer Discretionary,Services-Misc. Amusement & Recreation
DK,Delek US Holdings Inc. Common Stock,$32.49,-0.90,-2.695%,2079985985.00,United States,2017,155287,Energy,Integrated oil Companies
DKL,Delek Logistics Partners L.P. Common Units representing Limited Partner Interests,$39.69,-0.04,-0.101%,1731151229.00,United States,2012,23636,Energy,Oil & Gas Production
DKS,Dick's Sporting Goods Inc Common Stock,$208.32,-0.43,-0.206%,17175637147.00,United States,2002,281411,Consumer Discretionary,Other Specialty Stores
DLB,Dolby Laboratories Common Stock,$82.75,0.24,0.291%,7909148431.00,United States,2005,18972,Technology,EDP Services
DLNG,Dynagas LNG Partners LP Common Units,$3.03,-0.01,-0.329%,111510808.00,Greece,,4242,Consumer Discretionary,Marine Transportation
DLNG^A,Dynagas LNG Partners LP 9.00% Series A Cumulative Redeemable Preferred Units,$25.35,-0.04,-0.158%,,Greece,,1298,,
DLNG^B,Dynagas LNG Partners LP 8.75% Series B Fixed to Floating Rate Cumulative Redeemable Perpetual Preferred Units liquidation preference $25.00 per Uni,$25.79,0.00,0.00%,,Greece,,453,,
DLR,Digital Realty Trust Inc. Common Stock,$143.425,0.825,0.579%,44790704273.00,United States,2004,130050,Real Estate,Real Estate Investment Trusts
DLR^J,Digital Realty Trust Inc. 5.250% Series J Cumulative Redeemable Preferred Stock,$21.89,0.05,0.229%,,United States,,138,,
DLR^K,Digital Realty Trust Inc. 5.850% Series K Cumulative Redeemable Preferred Stock par value $0.01 per share,$23.74,0.04,0.169%,,United States,,5511,,
DLR^L,Digital Realty Trust Inc. 5.200% Series L Cumulative Redeemable Preferred Stock,$21.66,-0.02,-0.092%,,United States,,6388,,
DLX,Deluxe Corporation Common Stock,$19.81,0.04,0.202%,868670006.00,United States,,9432,Consumer Discretionary,Advertising
DLY,DoubleLine Yield Opportunities Fund Common Shares of Beneficial Interest,$15.89,-0.05,-0.314%,761858428.00,United States,2020,38196,Finance,Investment Managers
DM,Desktop Metal Inc. Class A Common Stock,$0.969,0.0373,4.003%,319417781.00,United States,2019,374958,Technology,Industrial Machinery/Components
DMA,Destra Multi-Alternative Fund Common Stock,$7.46,-0.02,-0.267%,0.00,,2022,608,Finance,Trusts Except Educational Religious and Charitable
DMB,BNY Mellon Municipal Bond Infrastructure Fund Inc. Common Stock,$10.1901,0.0301,0.296%,0.00,,2013,20815,Finance,Trusts Except Educational Religious and Charitable
DMO,Western Asset Mortgage Opportunity Fund Inc. Common Stock,$11.78,-0.05,-0.423%,0.00,United States,2010,25045,Finance,Trusts Except Educational Religious and Charitable
DNA,Ginkgo Bioworks Holdings Inc. Class A Common Stock,$1.07,-0.01,-0.926%,2303063491.00,United States,2021,4006767,Health Care,Biotechnology: Biological Products (No Diagnostic Substances)
DNB,Dun & Bradstreet Holdings Inc. Common Stock,$9.545,0.055,0.58%,4188308183.00,United States,2020,326342,Finance,Finance: Consumer Services
DNMR,Danimer Scientific Inc. Common Stock,$1.10,0.05,4.762%,125665013.00,United States,2020,111621,Industrials,Major Chemicals
DNOW,DNOW Inc. Common Stock,$15.25,0.09,0.594%,1619032964.00,United States,2014,37020,Industrials,Metal Fabrications
DNP,DNP Select Income Fund Inc. Common Stock,$8.99,0.02,0.223%,0.00,United States,1987,64905,Finance,Investment Managers
DO,Diamond Offshore Drilling Inc. Common Stock,$14.325,-0.255,-1.749%,1467841308.00,United States,2022,169778,Energy,Oil & Gas Production
DOC,Healthpeak Properties Inc. Common Stock,$18.605,-0.025,-0.134%,10180153349.00,United States,,508749,Real Estate,Real Estate Investment Trusts
DOCN,DigitalOcean Holdings Inc. Common Stock,$37.58,0.26,0.697%,3412139798.00,United States,2021,53529,Technology,Retail: Computer Software & Peripheral Equipment
DOCS,Doximity Inc. Class A Common Stock,$26.19,0.38,1.472%,4885842713.00,United States,2021,1173506,Technology,Retail: Computer Software & Peripheral Equipment
DOLE,Dole plc Ordinary Shares,$11.7901,0.0901,0.77%,1119224513.00,Ireland,2021,33447,Consumer Staples,Farming/Seeds/Milling
DOMA,Doma Holdings Inc. Common Stock,$6.06,0.01,0.165%,84159898.00,United States,2021,5100,Finance,Real Estate
DOOR,Masonite International Corporation Ordinary Shares (Canada),$130.96,0.21,0.161%,2872273914.00,Canada,,53395,Basic Materials,Forest Products
DOUG,Douglas Elliman Inc. Common Stock,$1.60,0.00,0.00%,146456659.00,United States,2021,62520,Real Estate,Building operators
DOV,Dover Corporation Common Stock,$177.00,1.16,0.66%,24761710590.00,United States,,129619,Industrials,Industrial Machinery/Components
DOW,Dow Inc. Common Stock ,$59.46,-0.23,-0.385%,41758367526.00,United States,2019,426555,Industrials,Major Chemicals
DPG,Duff & Phelps Utility and Infrastructure Fund Inc.,$9.37,0.01,0.107%,0.00,United States,2011,17014,Finance,Trusts Except Educational Religious and Charitable
DPZ,Domino's Pizza Inc Common Stock,$501.60,8.40,1.703%,17462061857.00,United States,2004,103720,Consumer Discretionary,Food Distributors
DQ,DAQO New Energy Corp. American Depositary Shares each representing five ordinary shares,$26.49,-0.55,-2.034%,2071641576.00,China,2010,167731,Technology,Semiconductors
DRD,DRDGOLD Limited American Depositary Shares,$8.71,-0.16,-1.804%,753056766.00,South Africa,,142697,Basic Materials,Precious Metals
DRH,Diamondrock Hospitality Company Common Stock,$9.42,-0.02,-0.212%,1974688196.00,United States,2005,71188,Real Estate,Real Estate Investment Trusts
DRH^A,Diamondrock Hospitality Company 8.250% Series A Cumulative Redeemable Preferred Stock,$25.36,0.00,0.00%,,United States,,11,,
DRI,Darden Restaurants Inc. Common Stock,$158.54,2.19,1.401%,18923167457.00,United States,,132765,Consumer Discretionary,Restaurants
DRQ,Dril-Quip Inc. Common Stock,$23.12,-0.08,-0.345%,795649507.00,United States,1997,7863,Industrials,Metal Fabrications
DSAQ,Direct Selling Acquisition Corp. Class A Common Stock,$11.12,0.06,0.542%,0.00,,2021,144,Finance,Blank Checks
DSL,DoubleLine Income Solutions Fund Common Shares of Beneficial Interests,$12.59,0.01,0.079%,1284140065.00,United States,2013,63079,Finance,Trusts Except Educational Religious and Charitable
DSM,BNY Mellon Strategic Municipal Bond Fund Inc. Common Stock,$5.78,0.06,1.049%,0.00,United States,1989,22981,Finance,Investment Managers
DSU,Blackrock Debt Strategies Fund Inc. Common Stock,$10.835,0.025,0.231%,0.00,United States,1998,42833,Finance,Finance Companies
DSX,Diana Shipping inc. common stock,$2.9202,-0.0298,-1.01%,455133641.00,Greece,2005,64399,Consumer Discretionary,Marine Transportation
DSX^B,Diana Shipping Inc. Perpetual Preferred Shares Series B (Marshall Islands),$26.70,0.00,0.00%,,Greece,,1011,,
DT,Dynatrace Inc. Common Stock,$46.82,0.84,1.827%,13858684698.00,United States,2019,513577,Technology,EDP Services
DTB,DTE Energy Company 2020 Series G 4.375% Junior Subordinated Debentures due 2080,$20.46,0.00,0.00%,4224028073.00,United States,2020,432,Utilities,Electric Utilities: Central
DTC,Solo Brands Inc. Class A Common Stock,$1.9393,0.0293,1.534%,176817578.00,United States,2021,51414,Consumer Discretionary,Recreational Games/Products/Toys
DTE,DTE Energy Company Common Stock,$109.645,0.545,0.50%,22636537540.00,United States,,95539,Utilities,Electric Utilities: Central
DTF,DTF Tax-Free Income 2028 Term Fund Inc. Common Stock,$10.70,0.005,0.047%,75216367.00,United States,1991,1911,Finance,Investment Managers
DTG,DTE Energy Company 2021 Series E 4.375% Junior Subordinated Debentures,$20.41,0.00,0.00%,4213705424.00,United States,2021,2341,Utilities,Electric Utilities: Central
DTM,DT Midstream Inc. Common Stock ,$62.70,-0.05,-0.08%,6080618161.00,United States,2021,74852,Utilities,Oil & Gas Production
DTW,DTE Energy Company 2017 Series E 5.25% Junior Subordinated Debentures due 2077,$24.78,0.00,0.00%,5115904968.00,United States,2017,1307,Utilities,Electric Utilities: Central
DUK,Duke Energy Corporation (Holding Company) Common Stock,$95.85,-0.06,-0.063%,73882277099.00,United States,,224456,Utilities,Power Generation
DUK^A,Duke Energy Corporation Depositary Shares each representing a 1/1000th interest in a share of 5.75% Series A Cumulative Redeemable Perpetual Preferred Stock,$25.24,0.075,0.298%,,United States,,2933,,
DUKB,Duke Energy Corporation 5.625% Junior Subordinated Debentures due 2078,$24.70,-0.04,-0.162%,19039042716.00,United States,2018,2992,Utilities,Power Generation
DV,DoubleVerify Holdings Inc. Common Stock,$33.22,0.46,1.404%,5689054624.00,United States,2021,149885,Technology,Computer Software: Prepackaged Software
DVA,DaVita Inc. Common Stock,$133.52,-0.09,-0.067%,11709704000.00,United States,,44990,Health Care,Misc Health and Biotechnology Services
DVN,Devon Energy Corporation Common Stock,$52.995,-0.275,-0.516%,33651825000.00,United States,1985,1254062,Energy,Oil & Gas Production
DX,Dynex Capital Inc. Common Stock,$12.075,-0.055,-0.453%,706923075.00,United States,,110792,Real Estate,Real Estate Investment Trusts
DX^C,Dynex Capital Inc. 6.900% Series C Fixed-to-Floating Rate Cumulative Redeemable Preferred Stock,$24.38,0.0322,0.132%,,United States,,3342,,
DXC,DXC Technology Company Common Stock ,$20.845,0.385,1.882%,3811938616.00,United States,,139802,Technology,EDP Services
DXYZ,Destiny Tech100 Inc. Common Stock,$73.1174,13.9174,23.509%,0.00,,2024,1866651,,
DY,Dycom Industries Inc. Common Stock,$142.32,0.00,0.00%,4140326474.00,United States,,16270,Industrials,Water Sewer Pipeline Comm & Power Line Construction
E,ENI S.p.A. Common Stock,$33.44,-0.31,-0.919%,56462736991.00,Italy,,55898,Energy,Oil & Gas Production
EAF,GrafTech International Ltd. Common Stock,$1.475,-0.035,-2.318%,378827008.00,United States,2018,416079,Energy,Industrial Machinery/Components
EAI,Entergy Arkansas LLC First Mortgage Bonds 4.875% Series Due September 1 2066,$22.45,0.04,0.178%,4787183042.00,United States,2016,2014,Utilities,Electric Utilities: Central
EARN,Ellington Residential Mortgage REIT Common Shares of Beneficial Interest,$6.75,-0.06,-0.881%,133782368.00,United States,2013,30896,Real Estate,Real Estate Investment Trusts
EAT,Brinker International Inc. Common Stock,$47.685,1.545,3.349%,2108970408.00,United States,,102806,Consumer Discretionary,Restaurants
EB,Eventbrite Inc. Class A Common Stock,$5.54,0.00,0.00%,564350354.00,United States,2018,227911,Technology,Computer Software: Programming Data Processing
EBF,Ennis Inc. Common Stock,$20.2099,0.0399,0.198%,522925079.00,United States,,3323,Consumer Discretionary,Office Equipment/Supplies/Services
EBR,Centrais Electricas Brasileiras S A American Depositary Shares (Each representing one Common Share),$8.24,0.10,1.229%,18925575943.00,Brazil,2016,86203,Utilities,Electric Utilities: Central
EBS,Emergent Biosolutions Inc. Common Stock,$2.295,0.005,0.218%,119806879.00,United States,2006,123503,Health Care,Biotechnology: Pharmaceutical Preparations
EC,Ecopetrol S.A. American Depositary Shares,$12.0609,-0.0891,-0.733%,24795217155.00,Colombia,,520461,Energy,Oil & Gas Production
ECAT,BlackRock ESG Capital Allocation Term Trust Common Shares of Beneficial Interest,$16.945,0.025,0.148%,1832347575.00,,2021,29105,Finance,Trusts Except Educational Religious and Charitable
ECC           ,Eagle Point Credit Company Inc. Common Stock,$10.295,0.055,0.537%,624520685.00,United States,2014,342547,Finance,Trusts Except Educational Religious and Charitable
ECC^D,Eagle Point Credit Company Inc. 6.75% Series D Preferred Stock,$20.05,-0.02,-0.10%,,United States,,2567,,
ECCC,Eagle Point Credit Company Inc. 6.50% Series C Term Preferred Stock due 2031,$22.07,0.0935,0.425%,1338821905.00,United States,,21987,Finance,Trusts Except Educational Religious and Charitable
ECCF,Eagle Point Credit Company Inc. 8.00% Series F Term Preferred Stock due 2029,$25.20,0.04,0.159%,27434555266.00,United States,,3896,,
ECCV,Eagle Point Credit Company Inc. 5.375% Notes due 2029,$22.44,0.08,0.358%,1361267039.00,United States,2022,1905,Finance,Trusts Except Educational Religious and Charitable
ECCW,Eagle Point Credit Company Inc. 6.75% Notes due 2031,$23.87,-0.07,-0.292%,1448014448.00,United States,2021,1663,Finance,Trusts Except Educational Religious and Charitable
ECCX,Eagle Point Credit Company Inc. 6.6875% Notes due 2028,$24.60,0.0015,0.006%,1492298090.00,United States,2022,811,Finance,Trusts Except Educational Religious and Charitable
ECL,Ecolab Inc. Common Stock,$228.17,0.42,0.184%,65145536576.00,United States,,76842,Consumer Discretionary,Package Goods/Cosmetics
ECO,Okeanis Eco Tankers Corp. Common Stock,$30.62,-0.56,-1.796%,0.00,,,32716,,
ECVT,Ecovyst Inc. Common Stock,$10.76,0.04,0.373%,1258746140.00,United States,2017,15991,Industrials,Major Chemicals
ED,Consolidated Edison Inc. Common Stock,$90.2099,0.5599,0.625%,31168425346.00,United States,,127066,Utilities,Power Generation
EDD,Morgan Stanley Emerging Markets Domestic Debt Fund Inc. Common Stock,$4.668,-0.012,-0.256%,0.00,United States,2007,31869,Finance,Finance Companies
EDF,Virtus Stone Harbor Emerging Markets Income Fund Common Shares of Beneficial Interest,$5.4699,0.0899,1.671%,0.00,United States,2010,27031,Finance,Investment Managers
EDN,Empresa Distribuidora Y Comercializadora Norte S.A. (Edenor) American Depositary Shares,$19.26,-0.04,-0.207%,872916261.00,Argentina,2007,8011,Utilities,Electric Utilities: Central
EDR,Endeavor Group Holdings Inc. Class A Common Stock,$26.53,0.16,0.607%,18371376076.00,United States,2021,432829,Consumer Discretionary,Services-Misc. Amusement & Recreation
EDU,New Oriental Education & Technology Group Inc. Sponsored ADR representing 10 Ordinary Share (Cayman Islands),$84.68,-0.66,-0.773%,14015592488.00,China,2006,295585,Real Estate,Other Consumer Services
EE,Excelerate Energy Inc. Class A Common Stock,$15.54,0.17,1.106%,1682745668.00,United States,2022,30561,Utilities,Oil/Gas Transmission
EEA,The European Equity Fund Inc. Common Stock,$8.83,-0.09,-1.009%,0.00,United States,,444,Finance,Trusts Except Educational Religious and Charitable
EEX,Emerald Holding Inc. Common Stock,$6.69,0.22,3.40%,421675664.00,United States,2017,726,Consumer Discretionary,Advertising
EFC,Ellington Financial Inc. Common Stock ,$11.37,-0.01,-0.088%,967634902.00,United States,2010,81688,Finance,Real Estate
EFC^A,Ellington Financial Inc. 6.750% Series A Fixed-to-Floating Rate Cumulative Redeemable Preferred Stock,$23.8193,-0.0257,-0.108%,,United States,,488,,
EFC^B,Ellington Financial Inc. 6.250% Series B Fixed-Rate Reset Cumulative Redeemable Preferred Stock,$20.60,0.00,0.00%,,United States,,23,,
EFC^C,Ellington Financial Inc. 8.625% Series C Fixed-Rate Reset Cumulative Redeemable Preferred Stock,$23.87,0.03,0.126%,,United States,,720,,
EFC^E,Ellington Financial Inc. 8.250% Series E Fixed-to-Floating Rate Cumulative Redeemable Preferred Stock,$25.24,0.02,0.079%,,United States,,620,,
EFR,Eaton Vance Senior Floating-Rate Fund Common Shares of Beneficial Interest,$13.035,0.075,0.579%,0.00,United States,2003,11051,Finance,Trusts Except Educational Religious and Charitable
EFT,Eaton Vance Floating Rate Income Trust Common Shares of Beneficial Interest,$13.34,0.04,0.301%,388066136.00,United States,2004,15775,Finance,Finance Companies
EFX,Equifax Inc. Common Stock,$258.22,2.07,0.808%,32008019284.00,United States,,62427,Finance,Finance: Consumer Services
EFXT,Enerflex Ltd Common Shares,$6.17,-0.03,-0.484%,764813857.00,Canada,2022,24642,Industrials,Industrial Machinery/Components
EG,Everest Group Ltd. Common Stock,$380.305,0.445,0.117%,16498229120.00,Bermuda,,21614,Finance,Property-Casualty Insurers
EGF,Blackrock Enhanced Government Fund Inc. Common Stock,$9.42,0.04,0.426%,0.00,United States,2005,101,Finance,Trusts Except Educational Religious and Charitable
EGLE,Eagle Bulk Shipping Inc. Common Stock,$61.451,-1.149,-1.835%,680437767.00,United States,,101712,Consumer Discretionary,Marine Transportation
EGO,Eldorado Gold Corporation Ordinary Shares,$15.005,-0.115,-0.761%,3048090957.00,Canada,,714452,Basic Materials,Precious Metals
EGP,EastGroup Properties Inc. Common Stock,$175.535,1.305,0.749%,8418059499.00,United States,,12584,Real Estate,Real Estate Investment Trusts
EGY,VAALCO Energy Inc.  Common Stock,$7.17,-0.12,-1.646%,740475820.00,United States,,268580,,
EHAB,Enhabit Inc. Common Stock,$11.1245,0.1045,0.948%,557959755.00,United States,2022,29207,Health Care,Hospital/Nursing Management
EHC,Encompass Health Corporation Common Stock,$82.785,-0.575,-0.69%,8290092466.00,United States,,67601,Health Care,Hospital/Nursing Management
EHI,Western Asset Global High Income Fund Inc Common Stock,$7.08,0.01,0.141%,0.00,United States,2003,14363,Finance,Investment Managers
EIC,Eagle Point Income Company Inc. Common Stock,$16.21,0.01,0.062%,144400431.00,,2019,51467,Finance,Finance/Investors Services
EICA,Eagle Point Income Company Inc. 5.00% Series A Term Preferred Stock due 2026,$23.47,0.09,0.385%,209073295.00,,2021,101,Finance,Finance/Investors Services
EICB,Eagle Point Income Company Inc. 7.75% Series B Term Preferred Stock Due 2028,$24.9007,-0.0393,-0.158%,0.00,,,2178,,
EIG,Employers Holdings Inc Common Stock,$44.04,-0.15,-0.339%,1114312808.00,United States,2007,3489,Finance,Property-Casualty Insurers
EIX,Edison International Common Stock,$70.725,-0.095,-0.134%,27195479420.00,United States,,260371,Utilities,Electric Utilities: Central
EL,Estee Lauder Companies Inc. (The) Common Stock,$146.36,1.93,1.336%,52466168141.00,United States,1995,405808,Consumer Discretionary,Package Goods/Cosmetics
ELAN,Elanco Animal Health Incorporated Common Stock,$15.475,-0.085,-0.546%,7628710920.00,United States,2018,270465,Health Care,Biotechnology: Pharmaceutical Preparations
ELC,Entergy Louisiana Inc. Collateral Trust Mortgage Bonds 4.875 % Series due September 1 2066,$22.57,0.04,0.178%,4812771549.00,United States,2016,511,Utilities,Electric Utilities: Central
ELF,e.l.f. Beauty Inc. Common Stock,$165.12,3.74,2.318%,9165304942.00,United States,2016,254277,Consumer Discretionary,Package Goods/Cosmetics
ELME,Elme Communities Common Stock,$14.75,0.62,4.388%,1296039120.00,United States,2000,121486,Real Estate,Real Estate Investment Trusts
ELP,Companhia Paranaense de Energia (COPEL) American Depositary Shares (each representing one Unit consisting one Common Share and four non-voting Class B Preferred Shares),$7.81,0.11,1.429%,2538928103.00,Brazil,2021,38657,Utilities,Electric Utilities: Central
ELPC,Companhia Paranaense de Energia (COPEL) American Depositary Shares (each representing four (4) Common Shares),$6.88,0.12,1.775%,2236597356.00,Brazil,2023,2326,Utilities,Electric Utilities: Central
ELS,Equity Lifestyle Properties Inc. Common Stock,$63.585,0.715,1.137%,11858109208.00,United States,,183261,Real Estate,Real Estate Investment Trusts
ELV,Elevance Health Inc. Common Stock,$507.80,0.45,0.089%,118149183633.00,United States,,95410,Health Care,Medical Specialities
EMD,Western Asset Emerging Markets Debt Fund Inc Common Stock,$9.43,0.05,0.533%,0.00,United States,,39110,Finance,Finance/Investors Services
EME,EMCOR Group Inc. Common Stock,$364.428,-0.592,-0.162%,17151776852.00,United States,,32718,Industrials,Engineering & Construction
EMF,Templeton Emerging Markets Fund Common Stock,$12.11,0.18,1.509%,0.00,United States,1987,6191,Finance,Finance/Investors Services
EMN,Eastman Chemical Company Common Stock,$100.39,0.56,0.561%,11780140167.00,United States,,53502,Industrials,Major Chemicals
EMO,ClearBridge Energy Midstream Opportunity Fund Inc. Common Stock,$41.415,0.095,0.23%,0.00,United States,2011,9041,Finance,Investment Managers
EMP,Entergy Mississippi LLC First Mortgage Bonds 4.90% Series Due October 1 2066,$22.97,-0.04,-0.174%,4898066569.00,United States,2016,1424,,
EMR,Emerson Electric Company Common Stock,$114.89,0.35,0.306%,65682613000.00,United States,,174970,Technology,Consumer Electronics/Appliances
ENB,Enbridge Inc Common Stock,$35.33,-0.02,-0.057%,75096965957.00,Canada,,441947,Energy,Natural Gas Distribution
ENFN,Enfusion Inc. Class A Common Stock,$9.49,0.09,0.957%,1215383465.00,United States,2021,10953,Technology,Computer Software: Prepackaged Software
ENIC,Enel Chile S.A. American Depositary Shares (Each representing 50 shares of Common Stock),$3.105,0.015,0.485%,4295243202.00,Chile,2016,28836,Utilities,Electric Utilities: Central
ENJ,Entergy New Orleans LLC First Mortgage Bonds 5.0% Series due December 1 2052,$22.5161,0.0461,0.205%,4801278045.00,United States,,119,Utilities,Power Generation
ENLC,EnLink Midstream LLC Common Units representing Limited Partner Interests,$13.84,-0.03,-0.216%,6271968448.00,United States,,74287,Utilities,Natural Gas Distribution
ENO,Entergy New Orleans LLC First Mortgage Bonds 5.50% Series due April 1 2066,$24.13,0.005,0.021%,5145422130.00,United States,2016,208,Utilities,Power Generation
ENOV,Enovis Corporation Common Stock,$60.57,-0.07,-0.115%,3308322619.00,United States,,11948,Health Care,Industrial Specialties
ENR,Energizer Holdings Inc. Common Stock,$28.115,0.255,0.915%,2018160349.00,United States,2015,23312,Miscellaneous,Industrial Machinery/Components
ENS,EnerSys Common Stock,$91.895,0.805,0.884%,3714026023.00,United States,2004,7876,Technology,Industrial Machinery/Components
ENV,Envestnet Inc Common Stock,$58.34,0.04,0.069%,3196378184.00,United States,2010,15385,Consumer Discretionary,Business Services
ENVA,Enova International Inc. Common Stock,$63.305,0.465,0.74%,1783641228.00,United States,2014,18968,Finance,Finance: Consumer Services
ENZ,Enzo Biochem Inc. Common Stock ($0.01 Par Value),$1.26,0.00,0.00%,64544425.00,United States,1988,90663,Health Care,Medical Specialities
EOD,Allspring Global Dividend Opportunity Fund Common Shares of Beneficial Interest,$4.74,0.04,0.851%,0.00,United States,2007,29685,Finance,Investment Managers
EOG,EOG Resources Inc. Common Stock,$135.12,-0.82,-0.603%,78369852945.00,United States,,492264,Energy,Oil & Gas Production
EOI,Eaton Vance Enhance Equity Income Fund Eaton Vance Enhanced Equity Income Fund Shares of Beneficial Interest,$18.33,-0.08,-0.435%,0.00,United States,2004,14335,Finance,Finance/Investors Services
EOS,Eaton Vance Enhance Equity Income Fund II Common Stock,$20.12,0.09,0.449%,0.00,,2005,33961,Finance,Trusts Except Educational Religious and Charitable
EOT,Eaton Vance Municipal Income Trust EATON VANCE NATIONAL MUNICIPAL OPPORTUNITIES TRUST,$16.4666,0.0366,0.223%,257289324.00,United States,2009,2520,Finance,Investment Managers
EP^C,El Paso Corporation Preferred Stock,$47.2501,-0.0898,-0.19%,,United States,,1246,,
EPAC,Enerpac Tool Group Corp. Common Stock,$35.36,0.17,0.483%,1918405174.00,United States,,11498,Industrials,Industrial Machinery/Components
EPAM,EPAM Systems Inc. Common Stock,$266.98,2.62,0.991%,15438785416.00,United States,2012,22424,Technology,EDP Services
EPC,Edgewell Personal Care Company Common Stock,$36.66,0.23,0.631%,1830548069.00,United States,,24207,Consumer Discretionary,Package Goods/Cosmetics
